,Exercises and Assignments / Assignment 2,post-12297,https://class.coursera.org/programming1-002/forum/thread?thread_id=2051#post-12297,Suman,comment-7450,https://class.coursera.org/programming1-002/forum/thread?thread_id=2051#comment-7450,"Ravi, when i call get_complementary_sequence('GCTDFER'), I am getting 'CGAGGGG' .","Monday, September 16th 2013, 6:52 am -04:00",2051,https://class.coursera.org/programming1-002/forum/thread?thread_id=2051, Unresolved,completed assignment2 with full marks in one go any doubts ask me,1379328723,https://class.coursera.org/programming1-002/forum/list?forum_id=19,Assignment 2,0,1
,Exercises and Assignments / Assignment 2,post-12297,https://class.coursera.org/programming1-002/forum/thread?thread_id=2051#post-12297,Suman,comment-7451,https://class.coursera.org/programming1-002/forum/thread?thread_id=2051#comment-7451,"Anonymous , I don't have any print statement in my functions.","Monday, September 16th 2013, 6:57 am -04:00",2051,https://class.coursera.org/programming1-002/forum/thread?thread_id=2051, Unresolved,completed assignment2 with full marks in one go any doubts ask me,1379329063,https://class.coursera.org/programming1-002/forum/list?forum_id=19,Assignment 2,0,1
,Exercises and Assignments / Assignment 2,post-12297,https://class.coursera.org/programming1-002/forum/thread?thread_id=2051#post-12297,Suman,comment-7456,https://class.coursera.org/programming1-002/forum/thread?thread_id=2051#comment-7456,"Ravi, after I modified my function get_complementary_sequence, now I am getting False if I call non valid sequence. Still the score after submission is 21.Ô_","Monday, September 16th 2013, 7:11 am -04:00",2051,https://class.coursera.org/programming1-002/forum/thread?thread_id=2051, Unresolved,completed assignment2 with full marks in one go any doubts ask me,1379329861,https://class.coursera.org/programming1-002/forum/list?forum_id=19,Assignment 2,0,1
,Course Tools,,,Steven M. Clester,post-2906,https://class.coursera.org/programming1-002/forum/thread?thread_id=420#post-2906,"I had the same problem.Ô_ It turns out that even though I had downloaded python 3.3, the shortcut was pointing to v2.7.Ô_ I modified the shortcut to point to the 3.3 folder, and I removed references to earlier versions from the environment variables.Ô_It all works now.","Thursday, August 22nd 2013, 12:15 am -04:00",420,https://class.coursera.org/programming1-002/forum/thread?thread_id=420, Resolved,IDLE not using floating pointing division,1377144954,https://class.coursera.org/programming1-002/forum/list?forum_id=10,Course Tools,0,1
,Exercises and Assignments / Assignment 2,,,Sergey Nagaev,post-11923,https://class.coursera.org/programming1-002/forum/thread?thread_id=2064#post-11923,You can glue final sequence from 3 pieces1st - original seq from 0 to index2nd - inserted seq3rd - remaining seq from index to endjust translate all three to python code and try,"Sunday, September 15th 2013, 9:32 am -04:00",2064,https://class.coursera.org/programming1-002/forum/thread?thread_id=2064, Resolved,Need help in the insert_sequence,1379251940,https://class.coursera.org/programming1-002/forum/list?forum_id=19,Assignment 2,2,1
,Exercises and Assignments / Assignment 2,,,Sergey Nagaev,post-11925,https://class.coursera.org/programming1-002/forum/thread?thread_id=2065#post-11925,I think it should looks likeÔ_def convert_to_minutes(num_hours):Ô_ Ô_ Ô_ Ô_ Ô_ Ô_ Ô_ '''(int) -> int,"Sunday, September 15th 2013, 9:35 am -04:00",2065,https://class.coursera.org/programming1-002/forum/thread?thread_id=2065, Unresolved,why am I getting syntaxerror,1379252122,https://class.coursera.org/programming1-002/forum/list?forum_id=19,Assignment 2,1,1
,Exercises and Assignments / Assignment 2,,,Sergey Nagaev,post-11926,https://class.coursera.org/programming1-002/forum/thread?thread_id=2065#post-11926,OopsMarc FÔ_was faster than me :),"Sunday, September 15th 2013, 9:36 am -04:00",2065,https://class.coursera.org/programming1-002/forum/thread?thread_id=2065, Unresolved,why am I getting syntaxerror,1379252187,https://class.coursera.org/programming1-002/forum/list?forum_id=19,Assignment 2,0,1
,Exercises and Assignments / Assignment 2,,,Sergey Nagaev,post-11935,https://class.coursera.org/programming1-002/forum/thread?thread_id=2064#post-11935,"look.Ô_for example you have got string 'AACCGGTT' and index 5it will looks likeÔ_>>> zzz = 'AACCGGTT'
>>> pos = 5
>>> zzz[0:pos]
'AACCG'
>>> zzz[pos:]
'GTT'
>>> ","Sunday, September 15th 2013, 9:56 am -04:00",2064,https://class.coursera.org/programming1-002/forum/thread?thread_id=2064, Resolved,Need help in the insert_sequence,1379253393,https://class.coursera.org/programming1-002/forum/list?forum_id=19,Assignment 2,0,1
,Exercises and Assignments / Assignment 2,,,Sergey Nagaev,post-11974,https://class.coursera.org/programming1-002/forum/thread?thread_id=2064#post-11974,"OK. I understand. it should looks likeÔ_insert_sequence('TTAGCTCC', 'GGG', 2) instead insert_sequence('TTAGCTCC', 'GGG', '2') third parameter must be the int not str. so just remove quotes around last parameter.","Sunday, September 15th 2013, 11:25 am -04:00",2064,https://class.coursera.org/programming1-002/forum/thread?thread_id=2064, Resolved,Need help in the insert_sequence,1379258741,https://class.coursera.org/programming1-002/forum/list?forum_id=19,Assignment 2,3,1
,Exercises and Assignments / Assignment 2,,,Sergey Nagaev,post-11993,https://class.coursera.org/programming1-002/forum/thread?thread_id=2064#post-11993,You already welcome.,"Sunday, September 15th 2013, 12:10 pm -04:00",2064,https://class.coursera.org/programming1-002/forum/thread?thread_id=2064, Resolved,Need help in the insert_sequence,1379261421,https://class.coursera.org/programming1-002/forum/list?forum_id=19,Assignment 2,0,1
,Lectures / Week 1 / Python as a Calculator,,,Renee Hebel,post-2257,https://class.coursera.org/programming1-002/forum/thread?thread_id=82#post-2257,"For Windows 8 users, the start menu had the links to both Idle & Python after install.","Tuesday, August 20th 2013, 7:47 pm -04:00",82,https://class.coursera.org/programming1-002/forum/thread?thread_id=82, Resolved,No IDLE application in python 3.3.2,1377042474,https://class.coursera.org/programming1-002/forum/list?forum_id=36,Python as a Calculator,0,1
,Exercises and Assignments / Assignment 2,,,Penny Lee,post-11314,https://class.coursera.org/programming1-002/forum/thread?thread_id=1946#post-11314,"I submitted my assignment twice but I am still having a little problem with the get_complementary_sequence because my code did not pass all the tests. Since I have a background in biology, when I read the description of the get_complementary_sequence function, I immediately thought of this as finding the reverse complement of a sequence. And it seemed to be true, because the auto-grader used the sequence 'GCTAGCTA' and expected it to return 'TAGCTAGC'. Like the name implies, first you take the complement of 'GCTAGCTA' (which is 'CGATCGAT') then reverse it to get 'TAGCTAGC'.So I was kind of confused when I saw that the example given in the handout stated that if we call this function with 'AT' as the argument, it returns 'TA'. However, using the same rule for the longer sequence, should not the function return 'AT' instead of 'TA'? Otherwise it is just returning the complement of 'AT'.","Friday, September 13th 2013, 2:05 pm -04:00",1946,https://class.coursera.org/programming1-002/forum/thread?thread_id=1946, Resolved,Assignment 2: question regarding the handout example for get_complementary_sequence,1379095516,https://class.coursera.org/programming1-002/forum/list?forum_id=19,Assignment 2,0,1
,Exercises and Assignments / Assignment 2,post-11317,https://class.coursera.org/programming1-002/forum/thread?thread_id=1946#post-11317,Penny Lee,comment-6683,https://class.coursera.org/programming1-002/forum/thread?thread_id=1946#comment-6683,I see. Yeah that message generated by the autograder really confused me. But now I know they are not looking for the reverse complement. Thanks a bunch!!!Ô_ ,"Friday, September 13th 2013, 2:16 pm -04:00",1946,https://class.coursera.org/programming1-002/forum/thread?thread_id=1946, Resolved,Assignment 2: question regarding the handout example for get_complementary_sequence,1379096208,https://class.coursera.org/programming1-002/forum/list?forum_id=19,Assignment 2,0,1
,Exercises and Assignments / Assignment 2,,,Penny Lee,post-11321,https://class.coursera.org/programming1-002/forum/thread?thread_id=1946#post-11321,Mystery case closed. Many thanks to those responded!!,"Friday, September 13th 2013, 2:17 pm -04:00",1946,https://class.coursera.org/programming1-002/forum/thread?thread_id=1946, Resolved,Assignment 2: question regarding the handout example for get_complementary_sequence,1379096271,https://class.coursera.org/programming1-002/forum/list?forum_id=19,Assignment 2,2,1
,Exercises and Assignments / Assignment 1,,,Darcy Donelle,post-6873,https://class.coursera.org/programming1-002/forum/thread?thread_id=1086#post-6873,"I am having the same issue today. Incidentally, I submitted the assignment twice, once after completing Step 2 (as instructed), then finally after submitting Step 7. The first submission (Step 2) was sent at 10:59 am, the second at 12:40 pm. Still no grade.Ô_","Sunday, September 1st 2013, 1:09 pm -04:00",1086,https://class.coursera.org/programming1-002/forum/thread?thread_id=1086," Resolved, Locked",Assignment1 Submission,1378055390,https://class.coursera.org/programming1-002/forum/list?forum_id=18,Assignment 1,0,1
,Exercises and Assignments / Assignment 1,post-6879,https://class.coursera.org/programming1-002/forum/thread?thread_id=1086#post-6879,Darcy Donelle,comment-3836,https://class.coursera.org/programming1-002/forum/thread?thread_id=1086#comment-3836,"Hi Raheel,I only submitted when instructed to do so - at Steps 2 & 7.Ô_","Sunday, September 1st 2013, 1:16 pm -04:00",1086,https://class.coursera.org/programming1-002/forum/thread?thread_id=1086," Resolved, Locked",Assignment1 Submission,1378055789,https://class.coursera.org/programming1-002/forum/list?forum_id=18,Assignment 1,0,1
,Exercises and Assignments / Assignment 1,post-6881,https://class.coursera.org/programming1-002/forum/thread?thread_id=1086#post-6881,Darcy Donelle,comment-3837,https://class.coursera.org/programming1-002/forum/thread?thread_id=1086#comment-3837,"4 hours? See bolded below:""Go to the Assignments page and click the appropriate Submit button. Choose your completedÔ_a1.pyÔ_file. It should be marked within a few minutes. You can view your results by clicking on the View button in the Feedback column.""","Sunday, September 1st 2013, 1:19 pm -04:00",1086,https://class.coursera.org/programming1-002/forum/thread?thread_id=1086," Resolved, Locked",Assignment1 Submission,1378055958,https://class.coursera.org/programming1-002/forum/list?forum_id=18,Assignment 1,0,1
,Exercises and Assignments / Assignment 1,,,Matthew Meznarsic,post-8191,https://class.coursera.org/programming1-002/forum/thread?thread_id=1342#post-8191,"So, I'm writing out my get_minutes and I'm getting back whole numbers and the correct answer when I pass it 3800. However, if I pass in 7200 I'm getting back 60, which while still correct should this roll back over to hours, or is this acceptable for the assignment?","Tuesday, September 3rd 2013, 9:20 pm -04:00",1342,https://class.coursera.org/programming1-002/forum/thread?thread_id=1342, Unresolved,get_minutes returning numbers greater than 60,1378257627,https://class.coursera.org/programming1-002/forum/list?forum_id=18,Assignment 1,0,1
,Exercises and Assignments / Assignment 1,,,Matthew Meznarsic,post-8216,https://class.coursera.org/programming1-002/forum/thread?thread_id=1342#post-8216,"Hmm, alright, I need to rethink this, like I said for 7200 I'm getting 66 instead of the expected 6. The code seems right, I think I just need to rethink the equation. (seconds - 3600) //60","Tuesday, September 3rd 2013, 10:39 pm -04:00",1342,https://class.coursera.org/programming1-002/forum/thread?thread_id=1342, Unresolved,get_minutes returning numbers greater than 60,1378262367,https://class.coursera.org/programming1-002/forum/list?forum_id=18,Assignment 1,0,1
,Exercises and Assignments / Assignment 1,,,Matthew Meznarsic,post-8235,https://class.coursera.org/programming1-002/forum/thread?thread_id=1342#post-8235,"Sorry, meant 7600","Tuesday, September 3rd 2013, 11:25 pm -04:00",1342,https://class.coursera.org/programming1-002/forum/thread?thread_id=1342, Unresolved,get_minutes returning numbers greater than 60,1378265121,https://class.coursera.org/programming1-002/forum/list?forum_id=18,Assignment 1,0,1
,Exercises and Assignments / Assignment 1,,,Matthew Meznarsic,post-8390,https://class.coursera.org/programming1-002/forum/thread?thread_id=1342#post-8390,"Ah, got it, makes a lot more sense now that I slept on it. Thanks","Wednesday, September 4th 2013, 10:44 am -04:00",1342,https://class.coursera.org/programming1-002/forum/thread?thread_id=1342, Unresolved,get_minutes returning numbers greater than 60,1378305877,https://class.coursera.org/programming1-002/forum/list?forum_id=18,Assignment 1,1,1
,Coursera Website (including technical issues),,,Ilia Kirsanau,post-6417,https://class.coursera.org/programming1-002/forum/thread?thread_id=926#post-6417,"Hi Roxy,There is iPad app - Coursistant, which you can use to download/watch videos. You can give it a try.99 cent version without ads - https://itunes.apple.com/us/app/coursistant/id681213120?ls=1&mt=8 Free version with ads - https://itunes.apple.com/us/app/coursistant-lite/id689386132?mt=8Ilia","Saturday, August 31st 2013, 3:09 pm -04:00",926,https://class.coursera.org/programming1-002/forum/thread?thread_id=926, Resolved,Videos cannot be played on iPad,1377976159,https://class.coursera.org/programming1-002/forum/list?forum_id=9,Coursera Website (including technical issues),1,1
,Coursera Website (including technical issues),,,Ilia Kirsanau,post-6418,https://class.coursera.org/programming1-002/forum/thread?thread_id=407#post-6418,"Hi Lee,There is iPad app - Coursistant, which you can use to download/watch videos. You can give it a try.99 cent version without ads - https://itunes.apple.com/us/app/coursistant/id681213120?ls=1&mt=8 Free version with ads - https://itunes.apple.com/us/app/coursistant-lite/id689386132?mt=8Ilia","Saturday, August 31st 2013, 3:10 pm -04:00",407,https://class.coursera.org/programming1-002/forum/thread?thread_id=407, Unresolved,"Video playback ipad, freezes and goes start",1377976254,https://class.coursera.org/programming1-002/forum/list?forum_id=9,Coursera Website (including technical issues),0,1
,Course Tools,post-675,https://class.coursera.org/programming1-002/forum/thread?thread_id=113#post-675,Ilia Kirsanau,comment-3460,https://class.coursera.org/programming1-002/forum/thread?thread_id=113#comment-3460,"There is iPad app - Coursistant, which you can use to download/watch videos. You can give it a try.99 cent version without ads - https://itunes.apple.com/us/app/coursistant/id681213120?ls=1&mt=8 Free version with ads - https://itunes.apple.com/us/app/coursistant-lite/id689386132?mt=8Although no quiz functionality yet.","Saturday, August 31st 2013, 3:14 pm -04:00",113,https://class.coursera.org/programming1-002/forum/thread?thread_id=113, Resolved,In video Quizzes,1377976467,https://class.coursera.org/programming1-002/forum/list?forum_id=10,Course Tools,0,1
,Study Groups,post-1736,https://class.coursera.org/programming1-002/forum/thread?thread_id=169#post-1736,Jakub Majer,comment-571,https://class.coursera.org/programming1-002/forum/thread?thread_id=169#comment-571,"Poradzisz, kaÅ_dy kiedyÅ_ zaczynaÅ_. Poza tym programowanie jest nie tylko dla informatykê_w, kaÅ_demu si„_ w zasadzie przyda. Powodzenia!","Tuesday, August 20th 2013, 5:12 am -04:00",169,https://class.coursera.org/programming1-002/forum/thread?thread_id=169,,Poland - study group.,1376989936,https://class.coursera.org/programming1-002/forum/list?forum_id=4,Study Groups,0,1
,Study Groups,post-6256,https://class.coursera.org/programming1-002/forum/thread?thread_id=169#post-6256,Jakub Majer,comment-3702,https://class.coursera.org/programming1-002/forum/thread?thread_id=169#comment-3702,WyskoczyÅ_o mi 37/41 i nie chce mi si„_ tego poprawia„_ ;) MoÅ_e wieczorem jeszcze przysi„óde.,"Sunday, September 1st 2013, 7:01 am -04:00",169,https://class.coursera.org/programming1-002/forum/thread?thread_id=169,,Poland - study group.,1378033306,https://class.coursera.org/programming1-002/forum/list?forum_id=4,Study Groups,0,1
,Study Groups,post-6256,https://class.coursera.org/programming1-002/forum/thread?thread_id=169#post-6256,Jakub Majer,comment-4059,https://class.coursera.org/programming1-002/forum/thread?thread_id=169#comment-4059,"Z jakim opê_Å_nieniem dziaÅ_a ten automatyczny oceniacz? Wchodz„_ dzisiaj rano, a tu 41/41.","Monday, September 2nd 2013, 3:58 am -04:00",169,https://class.coursera.org/programming1-002/forum/thread?thread_id=169,,Poland - study group.,1378108711,https://class.coursera.org/programming1-002/forum/list?forum_id=4,Study Groups,0,1
,Study Groups,post-6256,https://class.coursera.org/programming1-002/forum/thread?thread_id=169#post-6256,Jakub Majer,comment-4116,https://class.coursera.org/programming1-002/forum/thread?thread_id=169#comment-4116,"No cê_Å_, na razie moÅ_na powiedzie„_, Å_e idzie lepiej niÅ_ s„ódziÅ_em. Zobaczymy, co przynios„ó kolejne tygodnie.","Monday, September 2nd 2013, 8:18 am -04:00",169,https://class.coursera.org/programming1-002/forum/thread?thread_id=169,,Poland - study group.,1378124304,https://class.coursera.org/programming1-002/forum/list?forum_id=4,Study Groups,0,1
,Lectures / Week 2 / Visualizing Function Calls,,,Augustin Theodor Floare,post-6426,https://class.coursera.org/programming1-002/forum/thread?thread_id=1014#post-6426,"def convert_to_minutes(num_hours):
    """"""(int) -> int
    Return the number of minutes there are in num_hours hours.
    >>> convert_to_minutes(2)
    120
    """"""
    result = num_hours * 60
    return resultIn the docstring of the above function we have the sentence ""Return the number of ..."" Because this is not in the present simple tense (such as ""Returns the number of ..."") then the other options are:1) the sentence use the imperative mode2) the sentence is a shorthand for a future tense (""It will return the number of .."")English is not my native language and I am really curious about the tense used in that docstring.What do you think?Thanks!","Saturday, August 31st 2013, 3:28 pm -04:00",1014,https://class.coursera.org/programming1-002/forum/thread?thread_id=1014, Unresolved,English grammar in docstring,1377977290,https://class.coursera.org/programming1-002/forum/list?forum_id=10049,Visualizing Function Calls,1,1
,Lectures / Week 2 / Visualizing Assignment Statements,,,Sean Scarfo,post-6579,https://class.coursera.org/programming1-002/forum/thread?thread_id=1026#post-6579,"For me... I think there is a bit too much of emphasis on memory addresses for 'new' newbies, like myself. Ô_","Saturday, August 31st 2013, 11:38 pm -04:00",1026,https://class.coursera.org/programming1-002/forum/thread?thread_id=1026, Resolved,Do we emphasize too much on memory?,1378006724,https://class.coursera.org/programming1-002/forum/list?forum_id=41,Visualizing Assignment Statements,0,1
,Course Tools,,,Logan Dixon,post-37,https://class.coursera.org/programming1-002/forum/thread?thread_id=28#post-37,"I was wondering if your team did any revisions or changes to the course material since last year's fall offering, and if so what were they? Just curious, thanks!","Sunday, August 18th 2013, 9:40 pm -04:00",28,https://class.coursera.org/programming1-002/forum/thread?thread_id=28, Resolved,Did You Guys Change Any of the Course Material Since the Last Offering?,1376876439,https://class.coursera.org/programming1-002/forum/list?forum_id=10,Course Tools,0,1
,Course Tools,,,Logan Dixon,post-41,https://class.coursera.org/programming1-002/forum/thread?thread_id=29#post-41,Will you guys be offering the followup course -- Learn to Program: Crafting Quality Code -- again too?Thanks!,"Sunday, August 18th 2013, 9:43 pm -04:00",29,https://class.coursera.org/programming1-002/forum/thread?thread_id=29, Resolved,Will You Guys Be Offering the Followup Course Again Too?,1376876595,https://class.coursera.org/programming1-002/forum/list?forum_id=10,Course Tools,18,1
,Course Tools,,,Logan Dixon,post-46,https://class.coursera.org/programming1-002/forum/thread?thread_id=30#post-46,Thank-you for offering your valuable time to teach this course. I've always wanted to learn how to program; and programming opportunities are cropping up more-and-more in my work environments and I want to be able to start taking advantage of them.,"Sunday, August 18th 2013, 9:47 pm -04:00",30,https://class.coursera.org/programming1-002/forum/thread?thread_id=30, Resolved,Thank-you Instructors & Staff Team for Offering Your Valuable Time to Teach This Course!,1376876824,https://class.coursera.org/programming1-002/forum/list?forum_id=10,Course Tools,44,1
,Lectures / Week 3 / Type bool,,,Logan Dixon,post-12367,https://class.coursera.org/programming1-002/forum/thread?thread_id=1401#post-12367,"Yes, it's incorrect.","Monday, September 16th 2013, 11:32 am -04:00",1401,https://class.coursera.org/programming1-002/forum/thread?thread_id=1401, Unresolved,Can someone help me understand the last in-video quiz of Lecture 3.2,1379345524,https://class.coursera.org/programming1-002/forum/list?forum_id=29,Type bool,0,1
,Study Groups,post-1009,https://class.coursera.org/programming1-002/forum/thread?thread_id=171#post-1009,Twyla E.  Hall,comment-2580,https://class.coursera.org/programming1-002/forum/thread?thread_id=171#comment-2580,"Etienne,I can code in Java but veryÔ_little Python. Count me in!Ô_ Where do I sign up?","Tuesday, August 27th 2013, 10:44 pm -04:00",171,https://class.coursera.org/programming1-002/forum/thread?thread_id=171,,Beginners Study Group,1377657843,https://class.coursera.org/programming1-002/forum/list?forum_id=4,Study Groups,0,1
,Exercises and Assignments / Exercise 1 / Discussion not specific to individual questions,,,Twyla E.  Hall,post-10383,https://class.coursera.org/programming1-002/forum/thread?thread_id=1765#post-10383,"Nick, usually you would be right about the real world. However, my boss in spite of these courses not being for credit, notices what courses I take on Coursera,, the grades I make andÔ_Ô_ whether I get a certificate with distinction or not. Not only do I have to keep my skills current, it is specifically written into my employment contact that I stay enrolledÔ_ in Coursera courses. While taking aÔ_ Coursera courseÔ_ recently, the deadline for the final exam was near in one of my class, IÔ_Ô_was told to do the final exam in the Coursera course, then I could return to work.Ô_I am permittedÔ_ to take Coursera courses for funÔ_ asÔ_ well butÔ_ my work schedule has beenÔ_Ô_heavy lately.Twyla HallFocusingÔ_ on Teaching (FOT), Chief Technical Officer","Wednesday, September 11th 2013, 3:42 am -04:00",1765,https://class.coursera.org/programming1-002/forum/thread?thread_id=1765,,Course rerun?,1378885355,https://class.coursera.org/programming1-002/forum/list?forum_id=10018,Discussion not specific to individual questions,0,1
,Exercises and Assignments / Exercise 1 / Discussion not specific to individual questions,,,Twyla E.  Hall,post-12156,https://class.coursera.org/programming1-002/forum/thread?thread_id=1765#post-12156,"I take the course again, don't worry, Nick. I do work for an fantastic employer, The best! My boss is quite correct, how can I help her if my skills are not update or subpar? I can't! Alain, everyÔ_ certificate or college course I take, my employer sees myÔ_ transcript. Ongoing education is important to her.","Sunday, September 15th 2013, 7:10 pm -04:00",1765,https://class.coursera.org/programming1-002/forum/thread?thread_id=1765,,Course rerun?,1379286653,https://class.coursera.org/programming1-002/forum/list?forum_id=10018,Discussion not specific to individual questions,0,1
,Exercises and Assignments / Exercise 1 / Discussion not specific to individual questions,,,Twyla E.  Hall,post-12159,https://class.coursera.org/programming1-002/forum/thread?thread_id=1765#post-12159,"Nick, easy weekly quizzes? Yak, no thanks.... I would rather not take the class atÔ_ all. Happy to miss that one! Did you unenrollÔ_ in protest?","Sunday, September 15th 2013, 7:16 pm -04:00",1765,https://class.coursera.org/programming1-002/forum/thread?thread_id=1765,,Course rerun?,1379286991,https://class.coursera.org/programming1-002/forum/list?forum_id=10018,Discussion not specific to individual questions,0,1
,Exercises and Assignments / Exercise 1 / Discussion not specific to individual questions,post-12156,https://class.coursera.org/programming1-002/forum/thread?thread_id=1765#post-12156,Twyla E.  Hall,comment-7334,https://class.coursera.org/programming1-002/forum/thread?thread_id=1765#comment-7334,I forgotÔ_ to put I will take instead of I take.,"Sunday, September 15th 2013, 7:18 pm -04:00",1765,https://class.coursera.org/programming1-002/forum/thread?thread_id=1765,,Course rerun?,1379287128,https://class.coursera.org/programming1-002/forum/list?forum_id=10018,Discussion not specific to individual questions,0,1
