,Study Groups,,,Ryan May,post-342,https://class.coursera.org/programming1-002/forum/thread?thread_id=88#post-342,"Montlake, reporting in! Anybody care to meet up at a cafe during or after Week 2 for a brainstorming, idea-sharing, or sit-quietly-with-your-headphones-in-while-doing-classwork-with-the-satisfaction-of-knowing-that-people-around-you-are-working-on-the-same-thing-if-you-have-a-question session? I'd personally prefer either of the first two, but I know the final option may be the more ""Seattle"" choice. :-3","Monday, August 19th 2013, 3:06 am -04:00",88,https://class.coursera.org/programming1-002/forum/thread?thread_id=88,,"Seattle, WA Study Group",1376895994,https://class.coursera.org/programming1-002/forum/list?forum_id=4,Study Groups,0,1
,Exercises and Assignments / Assignment 1,,,Robert John Margetts,post-6844,https://class.coursera.org/programming1-002/forum/thread?thread_id=1086#post-6844,Yeah i'm having the same problem. Ô_I uploaded yesterday and all was well. Ô_Done the same thing today but keeps saying Not available. Ô_Anybody know why?,"Sunday, September 1st 2013, 12:31 pm -04:00",1086,https://class.coursera.org/programming1-002/forum/thread?thread_id=1086," Resolved, Locked",Assignment1 Submission,1378053114,https://class.coursera.org/programming1-002/forum/list?forum_id=18,Assignment 1,0,1
,Exercises and Assignments / Assignment 1,,,Robert John Margetts,post-6850,https://class.coursera.org/programming1-002/forum/thread?thread_id=1086#post-6850,"Yes Les, i'm currently on 24.0 out of 41.0. Ô_I'm sure it'll be working tomorrow. I'll try again then.","Sunday, September 1st 2013, 12:39 pm -04:00",1086,https://class.coursera.org/programming1-002/forum/thread?thread_id=1086," Resolved, Locked",Assignment1 Submission,1378053561,https://class.coursera.org/programming1-002/forum/list?forum_id=18,Assignment 1,0,1
,Exercises and Assignments / Assignment 1,,,Robert John Margetts,post-6882,https://class.coursera.org/programming1-002/forum/thread?thread_id=1086#post-6882,"YOu can submit up to once an hour according to the notes, but it work's more often too. Ô_Bear in mind that the more you upload, the slower the system will be for everyone else. ;-)","Sunday, September 1st 2013, 1:17 pm -04:00",1086,https://class.coursera.org/programming1-002/forum/thread?thread_id=1086," Resolved, Locked",Assignment1 Submission,1378055823,https://class.coursera.org/programming1-002/forum/list?forum_id=18,Assignment 1,0,1
,Exercises and Assignments / Assignment 1,,,Robert John Margetts,post-7411,https://class.coursera.org/programming1-002/forum/thread?thread_id=1183#post-7411,"Hey, I had the same error, but just resolved it. Ô_I now have 42/41. To solve it, think about what happens when the number of seconds goes above 24 hours and then add something to your code to allow for this ;-)","Monday, September 2nd 2013, 12:47 pm -04:00",1183,https://class.coursera.org/programming1-002/forum/thread?thread_id=1183, Resolved,RAW SCORE 41 / 41 NOT 42 / 41,1378140474,https://class.coursera.org/programming1-002/forum/list?forum_id=18,Assignment 1,5,1
,Exercises and Assignments / Assignment 2,,,Robert John Margetts,post-13294,https://class.coursera.org/programming1-002/forum/thread?thread_id=2296#post-13294,"Can anyone help me? Ô_I think my code is right, but I am getting nothing as an answer when I use get_compliment(complimentary_sequence)My code is as follows:Ô_complimentary_sequence = ''Ô_ Ô_ Ô_ Ô_ Ô_ Ô_ Ô_ Ô_Ô_ Ô_ for char in dna:Ô_ Ô_ Ô_ Ô_ if char in 'CGTA':Ô_ Ô_ Ô_ Ô_ Ô_ Ô_complimentary_sequence = complimentary_sequence + charÔ_ Ô_ Ô_ Ô_Ô_Ô_ Ô_ return get_compliment(complimentary_sequence)if I leave the get_compliment part out, then the code returns the right characters, just not the compliments. Ô_It must be something to do with the get_compliment code which I wrote, which works, but i'm not sure if it's correct. Ô_Am I making a massive error somewhere?Thanks!","Friday, September 20th 2013, 11:14 am -04:00",2296,https://class.coursera.org/programming1-002/forum/thread?thread_id=2296, Unresolved,get_complement & get_complementary_sequence,1379690050,https://class.coursera.org/programming1-002/forum/list?forum_id=19,Assignment 2,0,1
,Exercises and Assignments / Assignment 2,post-13294,https://class.coursera.org/programming1-002/forum/thread?thread_id=2296#post-13294,Robert John Margetts,comment-8306,https://class.coursera.org/programming1-002/forum/thread?thread_id=2296#comment-8306,"OK, thank you for the spelling correction, I oversaw that. Ô_I now have 21 out of 24. Ô_But the end part is still not working for some reason. Ô_Do you mean I should move the get_compliment up like this:complimentary_sequence = get_complement(complementary_sequence) + charÔ_ Ô_ Ô_ Ô_Ô_Ô_ Ô_ return complementary_sequenceI tried that and get an error...Ô_Been trying this for ages now and would love some more tips if anyone can give me them! Thanks!","Friday, September 20th 2013, 11:29 am -04:00",2296,https://class.coursera.org/programming1-002/forum/thread?thread_id=2296, Unresolved,get_complement & get_complementary_sequence,1379690999,https://class.coursera.org/programming1-002/forum/list?forum_id=19,Assignment 2,0,1
,Exercises and Assignments / Assignment 2,post-13294,https://class.coursera.org/programming1-002/forum/thread?thread_id=2296#post-13294,Robert John Margetts,comment-8317,https://class.coursera.org/programming1-002/forum/thread?thread_id=2296#comment-8317,"ahhhhh OK, I got it now! I tried adding the get_complement parts to 2 of the 3 possibilities and ignored the third possibility for some reason! Thanks so much!","Friday, September 20th 2013, 11:53 am -04:00",2296,https://class.coursera.org/programming1-002/forum/thread?thread_id=2296, Unresolved,get_complement & get_complementary_sequence,1379692390,https://class.coursera.org/programming1-002/forum/list?forum_id=19,Assignment 2,0,1
,Lectures / Week 1 / Built-in Functions,,,Kira Harland,post-2162,https://class.coursera.org/programming1-002/forum/thread?thread_id=330#post-2162,"When I put in 2 arguments, Python says there is a syntax error. ex:>>> round(54.6665[5])Traceback (most recent call last):Ô_ File ""<pyshell#10>"", line 1, in <module>Ô_ Ô_ round(54.6665[5])TypeError: 'float' object is not subscriptablewhat is going on here? I tried it with a comma before the second argument and that didn't work either","Tuesday, August 20th 2013, 4:33 pm -04:00",330,https://class.coursera.org/programming1-002/forum/thread?thread_id=330, Resolved,"round(number[, ndigits])",1377030788,https://class.coursera.org/programming1-002/forum/list?forum_id=39,Built-in Functions,0,1
,Lectures / Week 3 / No if required,,,Kira Harland,post-9403,https://class.coursera.org/programming1-002/forum/thread?thread_id=1252#post-9403,"I wrote for my answer:return temp > 28 or temp < 12And it came up as incorrect, what was the correct answer? It doesn't say","Sunday, September 8th 2013, 2:47 pm -04:00",1252,https://class.coursera.org/programming1-002/forum/thread?thread_id=1252, Resolved,inhospitable_weather never returns False,1378666037,https://class.coursera.org/programming1-002/forum/list?forum_id=33,No if required,0,1
,Study Groups,,,Hary,post-1202,https://class.coursera.org/programming1-002/forum/thread?thread_id=169#post-1202,"Hey Guys,I started the course today. but Nie mê_wi„_ po polski. :)","Monday, August 19th 2013, 5:31 pm -04:00",169,https://class.coursera.org/programming1-002/forum/thread?thread_id=169,,Poland - study group.,1376947915,https://class.coursera.org/programming1-002/forum/list?forum_id=4,Study Groups,0,1
,Lectures / Week 1 / Built-in Functions,,,Kieran Cornwall,post-1899,https://class.coursera.org/programming1-002/forum/thread?thread_id=241#post-1899,I'm on Mac and still suffer the same issue. Difficult to find anything useful on Google.,"Tuesday, August 20th 2013, 9:38 am -04:00",241,https://class.coursera.org/programming1-002/forum/thread?thread_id=241, Unresolved,The yellow pop up box,1377005892,https://class.coursera.org/programming1-002/forum/list?forum_id=39,Built-in Functions,0,1
,Study Groups,,,juanmixp,post-529,https://class.coursera.org/programming1-002/forum/thread?thread_id=85#post-529,"Hola, yo tambiê©n me aê±ado al grupo del fb y asê_ entre todos podemos resolver dudas.","Monday, August 19th 2013, 6:49 am -04:00",85,https://class.coursera.org/programming1-002/forum/thread?thread_id=85,,Spanish Study Group,1376909388,https://class.coursera.org/programming1-002/forum/list?forum_id=4,Study Groups,0,1
,Off-topic Discussion,,,juanmixp,post-1780,https://class.coursera.org/programming1-002/forum/thread?thread_id=207#post-1780,Thank you for your advice. Yesterday I saw this course and I enrolled. Now I am sure that it'll be great,"Tuesday, August 20th 2013, 6:41 am -04:00",207,https://class.coursera.org/programming1-002/forum/thread?thread_id=207,,Recommendation,1376995297,https://class.coursera.org/programming1-002/forum/list?forum_id=2,Off-topic Discussion,0,1
,Exercises and Assignments / Assignment 2,,,Mohammad Boroujerdi,post-13274,https://class.coursera.org/programming1-002/forum/thread?thread_id=2281#post-13274,Could you tell me what is the problem with my code:def is_valid_sequence(dna):valid = ('ATCG')Ô_ Ô_ for char in dna:Ô_ Ô_ Ô_ Ô_ if char in valid:Ô_ Ô_ Ô_ Ô_ Ô_ Ô_ return TrueÔ_ Ô_ Ô_ Ô_ else: return False,"Friday, September 20th 2013, 9:25 am -04:00",2281,https://class.coursera.org/programming1-002/forum/thread?thread_id=2281, Resolved,is_valide_sequence,1379683501,https://class.coursera.org/programming1-002/forum/list?forum_id=19,Assignment 2,0,1
,Exercises and Assignments / Assignment 1,,,Alexander Hanff,post-4465,https://class.coursera.org/programming1-002/forum/thread?thread_id=649#post-4465,"I get this error on every single function in the grading of the assignement:Method Description:Test the example in the handout.
Message:ERROR: AttributeError
'ReplacerModule' object has no attribute 'get_hours'Yet all the functions work fine when I run them in IDLE and the a1_gui.py script runs fine as well displaying the correct times and whether or not it is before noon (light) afternoon (dark). Ô_So I am not sure what the problem is.Anyone got any solutions?Regards,Alex","Monday, August 26th 2013, 7:03 pm -04:00",649,https://class.coursera.org/programming1-002/forum/thread?thread_id=649, Resolved,Problem submitting my Assignment,1377558228,https://class.coursera.org/programming1-002/forum/list?forum_id=18,Assignment 1,0,1
,Exercises and Assignments / Assignment 1,,,Alexander Hanff,post-4467,https://class.coursera.org/programming1-002/forum/thread?thread_id=649#post-4467,"OK it seems to be fixed now, I simply re-submitted the file and it graded properly. Ô_Not sure why I got the bug the first time round, if anyone else has this problem, I recommend re-submitting the assignment file.","Monday, August 26th 2013, 7:08 pm -04:00",649,https://class.coursera.org/programming1-002/forum/thread?thread_id=649, Resolved,Problem submitting my Assignment,1377558482,https://class.coursera.org/programming1-002/forum/list?forum_id=18,Assignment 1,1,1
,Lectures / Week 1 / Python and Computer Memory,,,Anna Myers,post-2254,https://class.coursera.org/programming1-002/forum/thread?thread_id=266#post-2254,Thanks for the post!,"Tuesday, August 20th 2013, 7:36 pm -04:00",266,https://class.coursera.org/programming1-002/forum/thread?thread_id=266," Pinned, Approved, Resolved",PDF of lecture summary (Python and computer memory),1377041787,https://class.coursera.org/programming1-002/forum/list?forum_id=37,Python and Computer Memory,0,1
,Exercises and Assignments / Assignment 1,,,Fernando Martê_n,post-8485,https://class.coursera.org/programming1-002/forum/thread?thread_id=1391#post-8485,"Hi,I have been struggling with assignment 1 for 2 hours. Specially, I have stuck in Step 5. I have been writing and writing codes without success, finally I read again the instructions and I realized that I did not understand what they are asking for. From that moment, things has become easier to complete the assignment.So: READ THE INSTRUCTIONS","Wednesday, September 4th 2013, 3:55 pm -04:00",1391,https://class.coursera.org/programming1-002/forum/thread?thread_id=1391, Unresolved,Piece of advice to success with Assignment 1,1378324502,https://class.coursera.org/programming1-002/forum/list?forum_id=18,Assignment 1,1,1
,Exercises and Assignments / Assignment 2,,,Anam Mughees,post-12878,https://class.coursera.org/programming1-002/forum/thread?thread_id=2232#post-12878,"hello,All the functions in my assignment 2 are running properly in the python shell and giving the expected results. The autograder however marks these functions as incorrect..The error msg says : ""attribute error"" whatever that means...please guide me on this","Wednesday, September 18th 2013, 12:25 pm -04:00",2232,https://class.coursera.org/programming1-002/forum/thread?thread_id=2232, Resolved,Problem with assignment 2 marking,1379521521,https://class.coursera.org/programming1-002/forum/list?forum_id=19,Assignment 2,0,1
,Exercises and Assignments / Assignment 2,,,Anam Mughees,post-12903,https://class.coursera.org/programming1-002/forum/thread?thread_id=2232#post-12903,yes its really hard to detect the mistakes because the code works fine when i run it,"Wednesday, September 18th 2013, 3:22 pm -04:00",2232,https://class.coursera.org/programming1-002/forum/thread?thread_id=2232, Resolved,Problem with assignment 2 marking,1379532167,https://class.coursera.org/programming1-002/forum/list?forum_id=19,Assignment 2,0,1
,Exercises and Assignments / Assignment 2,,,Anam Mughees,post-13040,https://class.coursera.org/programming1-002/forum/thread?thread_id=2232#post-13040,"def insert_sequence(dna1,dna2,indx):Ô_ Ô_ """"""Ô_ Ô_ (str, str, int) -> strÔ_ Ô_ Return the DNA sequence obtained by inserting the second DNA sequence intoÔ_ Ô_ the first DNA sequence at the given index.Ô_ Ô_ (You can assume that the index is valid.)Ô_ Ô_ >>> insert_sequence('CCGG', 'AT',2)Ô_ Ô_ 'CCATGG'Ô_ Ô_ >>> insert_sequence('ATTG', 'GCT', 0)Ô_ Ô_ 'GCTATTG'Ô_ Ô_ >>> insert_sequence('ATCG', 'AC', 4)Ô_ Ô_ 'ATCGAC'Ô_ Ô_ """"""Ô_ Ô_ [Code removed ~ep]","Thursday, September 19th 2013, 3:46 am -04:00",2232,https://class.coursera.org/programming1-002/forum/thread?thread_id=2232, Resolved,Problem with assignment 2 marking,1379576783,https://class.coursera.org/programming1-002/forum/list?forum_id=19,Assignment 2,0,1
,Exercises and Assignments / Assignment 2,,,Anam Mughees,post-13097,https://class.coursera.org/programming1-002/forum/thread?thread_id=2232#post-13097,"i have submitted the same file a few times,.. the latest report only lists 6 'Failures' now and no errors... i guess it might be a technical error aor there is some little problem with the code..Anyway thankyou evrryone for offering help.. my score is 18 marks and sice i scored 42 on first assignment i will manage to pass the course i think if i do all right in the next assignments and final exam :)thankyou","Thursday, September 19th 2013, 10:15 am -04:00",2232,https://class.coursera.org/programming1-002/forum/thread?thread_id=2232, Resolved,Problem with assignment 2 marking,1379600150,https://class.coursera.org/programming1-002/forum/list?forum_id=19,Assignment 2,0,1
,Exercises and Assignments / Assignment 2,,,Anam Mughees,post-13099,https://class.coursera.org/programming1-002/forum/thread?thread_id=2232#post-13099,and another thing.. problem is not of spaces.. it seems 2 spaces in the post here.. but in the actual file its four spaces,"Thursday, September 19th 2013, 10:18 am -04:00",2232,https://class.coursera.org/programming1-002/forum/thread?thread_id=2232, Resolved,Problem with assignment 2 marking,1379600294,https://class.coursera.org/programming1-002/forum/list?forum_id=19,Assignment 2,0,1
,Exercises and Assignments / Assignment 2,post-13144,https://class.coursera.org/programming1-002/forum/thread?thread_id=2232#post-13144,Anam Mughees,comment-8256,https://class.coursera.org/programming1-002/forum/thread?thread_id=2232#comment-8256,maybe there is some technical error.. hope the TA replies soon,"Friday, September 20th 2013, 2:52 am -04:00",2232,https://class.coursera.org/programming1-002/forum/thread?thread_id=2232, Resolved,Problem with assignment 2 marking,1379659940,https://class.coursera.org/programming1-002/forum/list?forum_id=19,Assignment 2,1,1
,Exercises and Assignments / Assignment 2,,,Anam Mughees,post-13237,https://class.coursera.org/programming1-002/forum/thread?thread_id=2232#post-13237,ok i got wats wrong with my code..'False' is not the samething as Falsethankyou @ETIENNE PAPEGNIESÔ_:),"Friday, September 20th 2013, 5:36 am -04:00",2232,https://class.coursera.org/programming1-002/forum/thread?thread_id=2232, Resolved,Problem with assignment 2 marking,1379669806,https://class.coursera.org/programming1-002/forum/list?forum_id=19,Assignment 2,0,1
,Lectures / Week 1 / Python as a Calculator,,,Paul John Morris,post-933,https://class.coursera.org/programming1-002/forum/thread?thread_id=48#post-933,"In my schooldays it was BEMDAS (Brackets, Exponentiation, Multiplication/Division, Addition/Subtraction. Somewhere in the intervening decades it transformed into BODMAS - which threw me when I found myself teaching High School maths. At the end of the day it all comes to the same thing. As has been mentioned, we also need to remember unary operators like negation, which didn't appear in the maths precedence rules.","Monday, August 19th 2013, 1:22 pm -04:00",48,https://class.coursera.org/programming1-002/forum/thread?thread_id=48, Resolved,Easy way to understand the operator precedence,1376932951,https://class.coursera.org/programming1-002/forum/list?forum_id=36,Python as a Calculator,0,1
,Course Tools,,,Paul John Morris,post-956,https://class.coursera.org/programming1-002/forum/thread?thread_id=83#post-956,"The last course I took had the same discussions - but in the opposite direction ""Why are we learning 2.7 when 3 is the most up to date?"". You can't please all the people all the time...","Monday, August 19th 2013, 1:41 pm -04:00",83,https://class.coursera.org/programming1-002/forum/thread?thread_id=83, Resolved,Python 2x or 3x,1376934105,https://class.coursera.org/programming1-002/forum/list?forum_id=10,Course Tools,5,1
,Off-topic Discussion,post-3612,https://class.coursera.org/programming1-002/forum/thread?thread_id=508#post-3612,Paul John Morris,comment-1843,https://class.coursera.org/programming1-002/forum/thread?thread_id=508#comment-1843,"I think Etienne is suggesting that you change the title of this thread to something like ""Interesting articles"" so others could add their own recommendations later.Ô_","Saturday, August 24th 2013, 2:03 pm -04:00",508,https://class.coursera.org/programming1-002/forum/thread?thread_id=508,,How an Arcane Coding Method from 1970s Banking Software Could Save the Sanity of Web Developers Everywhere,1377367420,https://class.coursera.org/programming1-002/forum/list?forum_id=2,Off-topic Discussion,0,1
,Exercises and Assignments / Assignment 1,,,Jesse Terpstra,post-7594,https://class.coursera.org/programming1-002/forum/thread?thread_id=1060#post-7594,"I've been watching the reuse lecture again, but i can't seem to understand how i can ""use theÔ_to_24_hour_clock function"" in this function, i've tried several ways but i either get a syntax error or Ô_a result of 83 when i do Ô_get_hours(300800)Ô_","Monday, September 2nd 2013, 6:33 pm -04:00",1060,https://class.coursera.org/programming1-002/forum/thread?thread_id=1060, Resolved,student: test_get_hours.TestGetHours.test_large_input Failure ?,1378161228,https://class.coursera.org/programming1-002/forum/list?forum_id=18,Assignment 1,0,1
,Exercises and Assignments / Assignment 1,,,Jesse Terpstra,post-7829,https://class.coursera.org/programming1-002/forum/thread?thread_id=1060#post-7829,"it was 2.30 AM and i was staring blank at the screen.. picked it up just now, fixed it at once!Ô_Thanks guys!","Tuesday, September 3rd 2013, 6:10 am -04:00",1060,https://class.coursera.org/programming1-002/forum/thread?thread_id=1060, Resolved,student: test_get_hours.TestGetHours.test_large_input Failure ?,1378203019,https://class.coursera.org/programming1-002/forum/list?forum_id=18,Assignment 1,0,1
,Course Tools,,,Haya Shamim Khan Khattak,post-9325,https://class.coursera.org/programming1-002/forum/thread?thread_id=66#post-9325,"Hi downloaded and installed the required version of Python on my pc running windows 8, for the first few days it worked fine, but now when I open IDLE I get the same error most of you have experienced i.e.Ô_'IDLE's subprocess didn't make connection. Either IDLE can't start a subprocess or personal firewall software is blocking a connection'I have tried the suggested solutions but they didn't work for me, I have to complete the assignment and quiz. Help is appreciated.Ô_","Sunday, September 8th 2013, 6:04 am -04:00",66,https://class.coursera.org/programming1-002/forum/thread?thread_id=66, Resolved,Can't start IDLE,1378634648,https://class.coursera.org/programming1-002/forum/list?forum_id=10,Course Tools,0,1
,Lectures / Week 2 / Docstrings and Function help,,,Ward Walker,post-7628,https://class.coursera.org/programming1-002/forum/thread?thread_id=1226#post-7628,"I was wondering about docstring examples.Ô_ It seems that in many cases, the docstring examples imply that values are being printed instead of returned because, when invoking the actual docstring examples, printed values will show up in IDLE but returned values will not (unless they're printed after the function call).I'm not sure what is common or best practice.For example, in the docstring below, the type contract & descriptionÔ_ clearly indicate that an integer is being returned.Ô_ But, the docstring examples imply that values will be printed instead of being returned (because how else would the values be presented within IDLE after the function call?).def get_num_upper_chars(word):   ''' (str) -> int   Returns the number of uppercase characters in word.   >>> get_num_upper_chars('BooK')   2   >>> get_num_upper_chars('BOOK')   4   '''Are the examples in the below docstring better?Ô_ I think they're a little better because they don't contradict the rest of the docstring.Ô_ def get_num_upper_chars(word):   ''' (str) -> int   Returns the number of uppercase characters in word.   >>> print get_num_upper_chars('BooK')   2   >>> print get_num_upper_chars('BOOK')   4   '''","Monday, September 2nd 2013, 8:12 pm -04:00",1226,https://class.coursera.org/programming1-002/forum/thread?thread_id=1226, Resolved,How to best show returned values in docstring examples?,1378167121,https://class.coursera.org/programming1-002/forum/list?forum_id=44,Docstrings and Function help,0,1
,Lectures / Week 2 / Docstrings and Function help,,,Ward Walker,post-7642,https://class.coursera.org/programming1-002/forum/thread?thread_id=1226#post-7642,"Oh, I see that even calling a function **does** print the value returned from the function call.Ô_Ô_ So, I guess my original question was based on a wrong understanding.Ô_ Marking this thread as resolved.Ô_ :)","Monday, September 2nd 2013, 9:04 pm -04:00",1226,https://class.coursera.org/programming1-002/forum/thread?thread_id=1226, Resolved,How to best show returned values in docstring examples?,1378170289,https://class.coursera.org/programming1-002/forum/list?forum_id=44,Docstrings and Function help,1,1
,Coursera Website (including technical issues),,,Eric Womer,post-3543,https://class.coursera.org/programming1-002/forum/thread?thread_id=500#post-3543,"The problem summary: I missed an r at the end of my name, the site its self I got it to change to the correct spelling but the cources sitehttps://class.coursera.org/programming1-002/class/indexbut there its still has the missing r.","Friday, August 23rd 2013, 5:05 pm -04:00",500,https://class.coursera.org/programming1-002/forum/thread?thread_id=500, Resolved,Name change,1377291957,https://class.coursera.org/programming1-002/forum/list?forum_id=9,Coursera Website (including technical issues),1,1
,Coursera Website (including technical issues),,,Eric Womer,post-3569,https://class.coursera.org/programming1-002/forum/thread?thread_id=500#post-3569,Its been hours since I changed it.,"Friday, August 23rd 2013, 6:45 pm -04:00",500,https://class.coursera.org/programming1-002/forum/thread?thread_id=500, Resolved,Name change,1377297916,https://class.coursera.org/programming1-002/forum/list?forum_id=9,Coursera Website (including technical issues),0,1
,Coursera Website (including technical issues),,,Eric Womer,post-3587,https://class.coursera.org/programming1-002/forum/thread?thread_id=500#post-3587,Ok thanks,"Friday, August 23rd 2013, 7:47 pm -04:00",500,https://class.coursera.org/programming1-002/forum/thread?thread_id=500, Resolved,Name change,1377301666,https://class.coursera.org/programming1-002/forum/list?forum_id=9,Coursera Website (including technical issues),0,1
,Coursera Website (including technical issues),,,Eric Womer,post-3744,https://class.coursera.org/programming1-002/forum/thread?thread_id=500#post-3744,Ok its fixed now thanks.,"Saturday, August 24th 2013, 10:29 am -04:00",500,https://class.coursera.org/programming1-002/forum/thread?thread_id=500, Resolved,Name change,1377354565,https://class.coursera.org/programming1-002/forum/list?forum_id=9,Coursera Website (including technical issues),0,1
,Study Groups,,,Erica Wu,post-2404,https://class.coursera.org/programming1-002/forum/thread?thread_id=103#post-2404,"Hi, My name is Erica, I live in San Francisco now.","Wednesday, August 21st 2013, 2:01 am -04:00",103,https://class.coursera.org/programming1-002/forum/thread?thread_id=103,,"Hey, Let's build the Chinese Study Group~",1377064887,https://class.coursera.org/programming1-002/forum/list?forum_id=4,Study Groups,0,1
