,Lectures / Week 1 / Defining Functions,,,SzuYing Cheng,post-6673,https://class.coursera.org/programming1-002/forum/thread?thread_id=1056#post-6673,"In last weeks' ""Defining Functions"" video,Ms. Campbell opened a new window and defined the triangle area function in it, which appeared right next to the current window where she restarted a new shell.I made the exact same directive and somehow the new window opened up as an independent window, separate from the one that I was working on at the moment.Anybody experimenting this problem too?Ô_How can I solve it?I'm on Windows XP 2003 SP3(32 bits) and the versions of Python I downloaded was v3.3.2","Sunday, September 1st 2013, 5:57 am -04:00",1056,https://class.coursera.org/programming1-002/forum/thread?thread_id=1056, Unresolved,Combining the the window into the current one,1378029429,https://class.coursera.org/programming1-002/forum/list?forum_id=40,Defining Functions,0,1
,Coursera Website (including technical issues),,,venkata vijaya bhaskar k,post-5213,https://class.coursera.org/programming1-002/forum/thread?thread_id=801#post-5213,The problem summary:Steps to reproduce:while playing video lectures. suddenly videos getting hanged and video time shows completed.Screenshot:,"Wednesday, August 28th 2013, 1:13 pm -04:00",801,https://class.coursera.org/programming1-002/forum/thread?thread_id=801, Unresolved,video lectures not progressing smoothly. getting hanged.,1377710011,https://class.coursera.org/programming1-002/forum/list?forum_id=9,Coursera Website (including technical issues),0,1
,Study Groups,,,Kim Bergeron,post-3105,https://class.coursera.org/programming1-002/forum/thread?thread_id=138#post-3105,Hi All!I'm interested in joining the group. It'll be a good way to keep myself in check to be on schedule. I've filled the form and look forward to getting updates on group meetings.,"Thursday, August 22nd 2013, 11:33 am -04:00",138,https://class.coursera.org/programming1-002/forum/thread?thread_id=138,,Toronto study group,1377185589,https://class.coursera.org/programming1-002/forum/list?forum_id=4,Study Groups,0,1
,Study Groups,,,"Arun Kishore, B.L.",post-2599,https://class.coursera.org/programming1-002/forum/thread?thread_id=357#post-2599,"Hi,Me Arun Kishore from Kerala.Thanks","Wednesday, August 21st 2013, 10:06 am -04:00",357,https://class.coursera.org/programming1-002/forum/thread?thread_id=357,,India Study Group!,1377094001,https://class.coursera.org/programming1-002/forum/list?forum_id=4,Study Groups,2,1
,Lectures / Week 2 / Input/Output and str Formatting,post-6353,https://class.coursera.org/programming1-002/forum/thread?thread_id=1000#post-6353,Yergali Berdibayev,comment-4092,https://class.coursera.org/programming1-002/forum/thread?thread_id=1000#comment-4092,"Hi there, Are you sure that all code lines there? Don't you miss anything there?","Monday, September 2nd 2013, 6:21 am -04:00",1000,https://class.coursera.org/programming1-002/forum/thread?thread_id=1000, Unresolved,Wrong ans in quiz 1 of video 3?,1378117270,https://class.coursera.org/programming1-002/forum/list?forum_id=43,Input/Output and str Formatting,0,1
,Lectures / Week 2 / Input/Output and str Formatting,post-6353,https://class.coursera.org/programming1-002/forum/thread?thread_id=1000#post-6353,Yergali Berdibayev,comment-4102,https://class.coursera.org/programming1-002/forum/thread?thread_id=1000#comment-4102,"Thanks, that's why I asked to you did you not miss something)) Anyway good luck!))","Monday, September 2nd 2013, 7:19 am -04:00",1000,https://class.coursera.org/programming1-002/forum/thread?thread_id=1000, Unresolved,Wrong ans in quiz 1 of video 3?,1378120765,https://class.coursera.org/programming1-002/forum/list?forum_id=43,Input/Output and str Formatting,0,1
,Lectures / Week 1 / Python as a Calculator,,,Mithru Thadhakar R,post-387,https://class.coursera.org/programming1-002/forum/thread?thread_id=97#post-387,Does the int division operator // have the same priority as /?,"Monday, August 19th 2013, 4:08 am -04:00",97,https://class.coursera.org/programming1-002/forum/thread?thread_id=97, Resolved,Int division,1376899696,https://class.coursera.org/programming1-002/forum/list?forum_id=36,Python as a Calculator,1,1
,Lectures / Week 1 / Getting Started: Installing Python,,,sagar rayamajhi,post-5566,https://class.coursera.org/programming1-002/forum/thread?thread_id=720#post-5566,i have done c programming course in university. does it help to use python??,"Thursday, August 29th 2013, 9:40 am -04:00",720,https://class.coursera.org/programming1-002/forum/thread?thread_id=720,,Best programming language,1377783645,https://class.coursera.org/programming1-002/forum/list?forum_id=35,Getting Started: Installing Python,0,1
,Lectures / Week 1 / Python as a Calculator,,,sagar rayamajhi,post-5627,https://class.coursera.org/programming1-002/forum/thread?thread_id=496#post-5627,how to distinguish between negation and subtraction?,"Thursday, August 29th 2013, 1:49 pm -04:00",496,https://class.coursera.org/programming1-002/forum/thread?thread_id=496, Resolved,explain the use of the operator ^,1377798546,https://class.coursera.org/programming1-002/forum/list?forum_id=36,Python as a Calculator,0,1
,Exercises and Assignments / Assignment 1,,,Dina Ahmad Khattab,post-9246,https://class.coursera.org/programming1-002/forum/thread?thread_id=1492#post-9246,I HAVE A PROBLEM WITH NO BUTTONS AT THE TOP OF THE SHELL..PLEASE HELP ME,"Saturday, September 7th 2013, 5:59 pm -04:00",1492,https://class.coursera.org/programming1-002/forum/thread?thread_id=1492, Unresolved,42/42 and CLOCK_WORKS,1378591150,https://class.coursera.org/programming1-002/forum/list?forum_id=18,Assignment 1,0,1
,Study Groups,post-1537,https://class.coursera.org/programming1-002/forum/thread?thread_id=94#post-1537,Dina Ahmad Khattab,comment-5438,https://class.coursera.org/programming1-002/forum/thread?thread_id=94#comment-5438,éóè±è_èëè_ è_é_è_ è‘èèé_èèé_ èëè_éÊéóé_é_è_ é_é_è_ é_éóè_è_è_è‘é_ éóè_è_è_èèé_..éÑé_éÅ éóéóéÑé_ è£è_é_é_ èëé_è_è_ éÊè£é_ è_è_è_éÊèëè_éÊè_è_è_éÅè© è_é_é_ è_é_èèé_ éóèäéÑéÊè© è_è_é_é_è© éÊéóé_ è£éÅè_è_ è_éÊèëè_é_è_é_é_ éóè_ è_é_èèé_ è£é_ è_èÎè_é_è_è±è_è_ éÅé_é_ é_éóè_é_é_ è_è_è±éÅè© éÑé_éÅ è£èªé_è±é_è_ è_éÊéÊé_ é_èÎéÊé_éÑéó è_è_è_èèé_é_é_,"Saturday, September 7th 2013, 6:02 pm -04:00",94,https://class.coursera.org/programming1-002/forum/thread?thread_id=94,,Arab and people who speak arabic study group,1378591366,https://class.coursera.org/programming1-002/forum/list?forum_id=4,Study Groups,0,1
,Exercises and Assignments / Assignment 1,post-9246,https://class.coursera.org/programming1-002/forum/thread?thread_id=1492#post-9246,Dina Ahmad Khattab,comment-5446,https://class.coursera.org/programming1-002/forum/thread?thread_id=1492#comment-5446,I mean menus..i can't see any one of these menus,"Saturday, September 7th 2013, 6:34 pm -04:00",1492,https://class.coursera.org/programming1-002/forum/thread?thread_id=1492, Unresolved,42/42 and CLOCK_WORKS,1378593285,https://class.coursera.org/programming1-002/forum/list?forum_id=18,Assignment 1,0,1
,Exercises and Assignments / Assignment 1,post-9246,https://class.coursera.org/programming1-002/forum/thread?thread_id=1492#post-9246,Dina Ahmad Khattab,comment-5450,https://class.coursera.org/programming1-002/forum/thread?thread_id=1492#comment-5450,thanks for the hint..I'm using windows 8 I don't know if anyone use it also if anyone can help with that I'll be thankful and also I'll try to find out the solution,"Saturday, September 7th 2013, 6:45 pm -04:00",1492,https://class.coursera.org/programming1-002/forum/thread?thread_id=1492, Unresolved,42/42 and CLOCK_WORKS,1378593951,https://class.coursera.org/programming1-002/forum/list?forum_id=18,Assignment 1,0,1
,Exercises and Assignments / Assignment 1,post-9246,https://class.coursera.org/programming1-002/forum/thread?thread_id=1492#post-9246,Dina Ahmad Khattab,comment-5456,https://class.coursera.org/programming1-002/forum/thread?thread_id=1492#comment-5456,thanks a lot..thank you so much Josê© Hê©ctor AlbanoÔ_yayaya it workedthanks too to Tom EnosÔ_the link is usefuelÔ_,"Saturday, September 7th 2013, 7:33 pm -04:00",1492,https://class.coursera.org/programming1-002/forum/thread?thread_id=1492, Unresolved,42/42 and CLOCK_WORKS,1378596821,https://class.coursera.org/programming1-002/forum/list?forum_id=18,Assignment 1,0,1
,Exercises and Assignments / Assignment 1,post-9246,https://class.coursera.org/programming1-002/forum/thread?thread_id=1492#post-9246,Dina Ahmad Khattab,comment-5457,https://class.coursera.org/programming1-002/forum/thread?thread_id=1492#comment-5457,it worked by the search,"Saturday, September 7th 2013, 7:34 pm -04:00",1492,https://class.coursera.org/programming1-002/forum/thread?thread_id=1492, Unresolved,42/42 and CLOCK_WORKS,1378596874,https://class.coursera.org/programming1-002/forum/list?forum_id=18,Assignment 1,0,1
,Lectures / Week 2 / Visualizing Assignment Statements,,,Charelle Collett,post-4269,https://class.coursera.org/programming1-002/forum/thread?thread_id=592#post-4269,They won't be posted until the 26th in Toronto (Which is UTC -4 I think?). Ô_Etienne's post has a countdown with how many hours to go.,"Monday, August 26th 2013, 7:48 am -04:00",592,https://class.coursera.org/programming1-002/forum/thread?thread_id=592, Resolved,When are the week but 2 classes made available,1377517688,https://class.coursera.org/programming1-002/forum/list?forum_id=41,Visualizing Assignment Statements,0,1
,Exercises and Assignments / Assignment 2,,,saif hassan,post-11187,https://class.coursera.org/programming1-002/forum/thread?thread_id=1887#post-11187,"what should get_Complement: method do, how it should work like...","Friday, September 13th 2013, 7:08 am -04:00",1887,https://class.coursera.org/programming1-002/forum/thread?thread_id=1887, Resolved,get_complement,1379070537,https://class.coursera.org/programming1-002/forum/list?forum_id=19,Assignment 2,0,1
,Exercises and Assignments / Assignment 2,,,saif hassan,post-11191,https://class.coursera.org/programming1-002/forum/thread?thread_id=1887#post-11191,I'm still not understanding this after reading problem domain section... just write an example for testing...,"Friday, September 13th 2013, 7:23 am -04:00",1887,https://class.coursera.org/programming1-002/forum/thread?thread_id=1887, Resolved,get_complement,1379071400,https://class.coursera.org/programming1-002/forum/list?forum_id=19,Assignment 2,0,1
,Exercises and Assignments / Assignment 2,,,saif hassan,post-11192,https://class.coursera.org/programming1-002/forum/thread?thread_id=1887#post-11192,just write 2 examples so that i can check wether my code is working correctly.,"Friday, September 13th 2013, 7:25 am -04:00",1887,https://class.coursera.org/programming1-002/forum/thread?thread_id=1887, Resolved,get_complement,1379071511,https://class.coursera.org/programming1-002/forum/list?forum_id=19,Assignment 2,0,1
,Exercises and Assignments / Assignment 2,post-11192,https://class.coursera.org/programming1-002/forum/thread?thread_id=1887#post-11192,saif hassan,comment-6606,https://class.coursera.org/programming1-002/forum/thread?thread_id=1887#comment-6606,Thank you,"Friday, September 13th 2013, 8:17 am -04:00",1887,https://class.coursera.org/programming1-002/forum/thread?thread_id=1887, Resolved,get_complement,1379074633,https://class.coursera.org/programming1-002/forum/list?forum_id=19,Assignment 2,0,1
,Exercises and Assignments / Assignment 1,post-5382,https://class.coursera.org/programming1-002/forum/thread?thread_id=840#post-5382,francis gan chin chye,comment-5183,https://class.coursera.org/programming1-002/forum/thread?thread_id=840#comment-5183,Can the sample answers be posted after the due date?Ô_ So that we can compare our answers?,"Friday, September 6th 2013, 5:11 am -04:00",840,https://class.coursera.org/programming1-002/forum/thread?thread_id=840," Pinned, Resolved",Are you struggling with Assignment 1? Here's some helpful advice.,1378458695,https://class.coursera.org/programming1-002/forum/list?forum_id=18,Assignment 1,1,1
,Exercises and Assignments / Assignment 2,post-10351,https://class.coursera.org/programming1-002/forum/thread?thread_id=1725#post-10351,francis gan chin chye,comment-6077,https://class.coursera.org/programming1-002/forum/thread?thread_id=1725#comment-6077,Do not use str methods.in the question --Assignment 2,"Wednesday, September 11th 2013, 3:21 am -04:00",1725,https://class.coursera.org/programming1-002/forum/thread?thread_id=1725, Resolved,AttributeError: 'function' object has no attribute 'count',1378884067,https://class.coursera.org/programming1-002/forum/list?forum_id=19,Assignment 2,0,1
,Final Exam,post-3571,https://class.coursera.org/programming1-002/forum/thread?thread_id=505#post-3571,francis gan chin chye,comment-8442,https://class.coursera.org/programming1-002/forum/thread?thread_id=505#comment-8442,Wonderful course.... ,"Saturday, September 21st 2013, 9:51 am -04:00",505,https://class.coursera.org/programming1-002/forum/thread?thread_id=505, Resolved,new season,1379771482,https://class.coursera.org/programming1-002/forum/list?forum_id=66,Final Exam,1,1
,Exercises and Assignments / Assignment 1,,,Goutam Das,post-10353,https://class.coursera.org/programming1-002/forum/thread?thread_id=1659#post-10353,"I found that I was not ""running"" the module prior to submission and that was giving problems.Ô_ I received all correct.Ô_ I am sorry, I should have read the instructions carefully.Ô_ I am still interested in the ""why"" a program needs to be run prior to submission.","Wednesday, September 11th 2013, 1:28 am -04:00",1659,https://class.coursera.org/programming1-002/forum/thread?thread_id=1659, Unresolved,Assignment 1 step 6,1378877332,https://class.coursera.org/programming1-002/forum/list?forum_id=18,Assignment 1,0,1
,Exercises and Assignments / Exercise 4 / Question 9 discussion,,,Tatiana Antonova,post-12718,https://class.coursera.org/programming1-002/forum/thread?thread_id=1843#post-12718,"Guy, thanks a lot, especially to Tom Enos with his explanation my_string = ""Hello Sandy, My sister name Sandy too"".It was really helpful and I finally found solution! Very happy) ","Tuesday, September 17th 2013, 6:21 pm -04:00",1843,https://class.coursera.org/programming1-002/forum/thread?thread_id=1843, Resolved,Trouble with the logic of this question,1379456494,https://class.coursera.org/programming1-002/forum/list?forum_id=10078,Question 9 discussion,0,1
,Lectures / Week 2 / Visualizing Assignment Statements,,,Kelly Bauman,post-5616,https://class.coursera.org/programming1-002/forum/thread?thread_id=690#post-5616,Thanks very much for that explanation!,"Thursday, August 29th 2013, 1:08 pm -04:00",690,https://class.coursera.org/programming1-002/forum/thread?thread_id=690, Unresolved,Memory address,1377796126,https://class.coursera.org/programming1-002/forum/list?forum_id=41,Visualizing Assignment Statements,0,1
,Exercises and Assignments / Assignment 1,,,Leya Rennert-May,post-5261,https://class.coursera.org/programming1-002/forum/thread?thread_id=809#post-5261,"I feel like a complete dunce as well. I have never done any programming before, have gone over and over the lectures, went through the exercise until I have all of the questions correct and am now totally lost again. I'm on Step 2, isn't the function already filled out? I don't understand what we're even supposed to be answering :(","Wednesday, August 28th 2013, 3:35 pm -04:00",809,https://class.coursera.org/programming1-002/forum/thread?thread_id=809, Unresolved,having alot of difficulty,1377718539,https://class.coursera.org/programming1-002/forum/list?forum_id=18,Assignment 1,2,1
,Exercises and Assignments / Assignment 1,,,Leya Rennert-May,post-5271,https://class.coursera.org/programming1-002/forum/thread?thread_id=809#post-5271,"Thanks, Luis!I keep getting a typeerror with this code:return seconds_difference(time_2 - time_1)Ô_What am I doing wrong?","Wednesday, August 28th 2013, 3:58 pm -04:00",809,https://class.coursera.org/programming1-002/forum/thread?thread_id=809, Unresolved,having alot of difficulty,1377719935,https://class.coursera.org/programming1-002/forum/list?forum_id=18,Assignment 1,0,1
,Exercises and Assignments / Assignment 1,,,Leya Rennert-May,post-5412,https://class.coursera.org/programming1-002/forum/thread?thread_id=809#post-5412,"Got it!!!! Woohoo :) Thanks so much, everyone! This really helped clarify some of the concepts for me. Ô_","Thursday, August 29th 2013, 12:10 am -04:00",809,https://class.coursera.org/programming1-002/forum/thread?thread_id=809, Unresolved,having alot of difficulty,1377749419,https://class.coursera.org/programming1-002/forum/list?forum_id=18,Assignment 1,2,1
,Exercises and Assignments / Exercise 3 / Question 1 discussion,,,Leya Rennert-May,post-8632,https://class.coursera.org/programming1-002/forum/thread?thread_id=1414#post-8632,"I can figure out this question just by looking at it, by I don't understand how to solve the problem by plugging the problem into Idle :( I'm concerned that as the problems get more difficult I'm going to need to understand how to do this instead correctly of just relying on intuition.Ô_I put in:def dollars(num):Ô_ Ô_ '''(num) -> num'''Ô_ Ô_ if dollars == 8:Ô_ Ô_ Ô_ Ô_ return TrueÔ_ Ô_ else:Ô_ Ô_ Ô_ Ô_ return FalseÔ_and I keep getting back typeerrors?? I feel like I'm not not on the right track here.Ô_","Thursday, September 5th 2013, 12:56 am -04:00",1414,https://class.coursera.org/programming1-002/forum/thread?thread_id=1414, Resolved,Plugging it into Idle,1378356967,https://class.coursera.org/programming1-002/forum/list?forum_id=10053,Question 1 discussion,0,1
,Exercises and Assignments / Exercise 3 / Question 1 discussion,,,Leya Rennert-May,post-8719,https://class.coursera.org/programming1-002/forum/thread?thread_id=1414#post-8719,Got it! Thanks!,"Thursday, September 5th 2013, 10:12 am -04:00",1414,https://class.coursera.org/programming1-002/forum/thread?thread_id=1414, Resolved,Plugging it into Idle,1378390345,https://class.coursera.org/programming1-002/forum/list?forum_id=10053,Question 1 discussion,0,1
,Exercises and Assignments / Assignment 2,,,Leya Rennert-May,post-10509,https://class.coursera.org/programming1-002/forum/thread?thread_id=1792#post-10509,"I have been futzing around with this for hours and am about ready to chuck my laptop out the window. With this code, everything seems okay, except that lowercase letters also come back as True. Ô_Ô_Ô_for char in dna:Ô_ Ô_ Ô_ Ô_ if char in 'ATCG':Ô_ Ô_ Ô_ Ô_ Ô_ Ô_ return TrueÔ_ Ô_ Ô_ Ô_Ô_Ô_ Ô_ Ô_ Ô_ if char not in 'ATCG':Ô_ Ô_ Ô_ Ô_ Ô_ Ô_ return FalseCan anyone help point me in the right direction? Thanks!","Wednesday, September 11th 2013, 10:35 am -04:00",1792,https://class.coursera.org/programming1-002/forum/thread?thread_id=1792, Unresolved,Is_Valid_Sequence Help,1378910105,https://class.coursera.org/programming1-002/forum/list?forum_id=19,Assignment 2,0,1
,Exercises and Assignments / Assignment 2,,,Leya Rennert-May,post-10513,https://class.coursera.org/programming1-002/forum/thread?thread_id=1792#post-10513,"So, for example, if I runÔ_is_valid_sequence('AtcTGT') it returns True. But this should return False :S","Wednesday, September 11th 2013, 10:49 am -04:00",1792,https://class.coursera.org/programming1-002/forum/thread?thread_id=1792, Unresolved,Is_Valid_Sequence Help,1378910999,https://class.coursera.org/programming1-002/forum/list?forum_id=19,Assignment 2,0,1
,Exercises and Assignments / Assignment 2,,,Leya Rennert-May,post-10524,https://class.coursera.org/programming1-002/forum/thread?thread_id=1792#post-10524,I think I'm getting further away....is_valid_sequence = 0Ô_ Ô_ for char in dna:Ô_ Ô_ Ô_ Ô_ if char in 'ATCG':Ô_ Ô_ Ô_ Ô_ Ô_ Ô_ is_valid_sequence + 1Ô_ Ô_ Ô_ Ô_Ô_Ô_ Ô_ if is_valid_sequence == len(dna):Ô_ Ô_ Ô_ Ô_ return TrueÔ_ Ô_ else:Ô_ Ô_ Ô_ Ô_ return FalseÔ_,"Wednesday, September 11th 2013, 11:08 am -04:00",1792,https://class.coursera.org/programming1-002/forum/thread?thread_id=1792, Unresolved,Is_Valid_Sequence Help,1378912119,https://class.coursera.org/programming1-002/forum/list?forum_id=19,Assignment 2,0,1
,Exercises and Assignments / Assignment 2,,,Leya Rennert-May,post-10536,https://class.coursera.org/programming1-002/forum/thread?thread_id=1792#post-10536,"Got it! Oh, thank God. Thanks everyone!Ô_","Wednesday, September 11th 2013, 11:29 am -04:00",1792,https://class.coursera.org/programming1-002/forum/thread?thread_id=1792, Unresolved,Is_Valid_Sequence Help,1378913369,https://class.coursera.org/programming1-002/forum/list?forum_id=19,Assignment 2,0,1
,Exercises and Assignments / Assignment 2,,,Leya Rennert-May,post-10612,https://class.coursera.org/programming1-002/forum/thread?thread_id=1813#post-10612,"I keep thinking I'm onto something, and then it's all wrong. I think I might just be making up terms now...return insert_sequence.insert(len(dna1),dna2)Ô_I've watched the splicing and indexing lecture over and over, and I can follow it clearly, but I can't seem to quite equate it to the assignment.Ô_","Wednesday, September 11th 2013, 2:52 pm -04:00",1813,https://class.coursera.org/programming1-002/forum/thread?thread_id=1813, Resolved,Lost Again - insert_sequence,1378925562,https://class.coursera.org/programming1-002/forum/list?forum_id=19,Assignment 2,0,1
,Exercises and Assignments / Assignment 2,,,Leya Rennert-May,post-10785,https://class.coursera.org/programming1-002/forum/thread?thread_id=1813#post-10785,Got it! Thanks everyone!Ô_,"Thursday, September 12th 2013, 12:18 am -04:00",1813,https://class.coursera.org/programming1-002/forum/thread?thread_id=1813, Resolved,Lost Again - insert_sequence,1378959490,https://class.coursera.org/programming1-002/forum/list?forum_id=19,Assignment 2,0,1
,Exercises and Assignments / Assignment 2,,,Leya Rennert-May,post-10817,https://class.coursera.org/programming1-002/forum/thread?thread_id=1848#post-10817,"I promise this is my last post.Ô_I understand the concept of the question, and so far have:def get_complementary_sequence(dna):Ô_ Ô_ """"""(str) -> strÔ_Ô_ Ô_ >>>get_complementary_sequence('CATTAC')Ô_ Ô_ GTAATGÔ_ Ô_ >>>get_complementary_sequence('ATCG')Ô_ Ô_ TAGCÔ_ Ô_ """"""Ô_ Ô_ dna == ''Ô_ Ô_ for char in dna:Ô_ Ô_ Ô_ Ô_ if char == 'A':Ô_ Ô_ Ô_ Ô_ Ô_ Ô_ dna = dna + 'T'Ô_ Ô_ Ô_ Ô_ elif char == 'T':Ô_ Ô_ Ô_ Ô_ Ô_ Ô_ dna = dna + 'A'Ô_ Ô_ Ô_ Ô_ elif char == 'C':Ô_ Ô_ Ô_ Ô_ Ô_ Ô_ dna = dna + 'G'Ô_ Ô_ Ô_ Ô_ elif char == 'G':Ô_ Ô_ Ô_ Ô_ Ô_ Ô_ dna = dna + 'C'Ô_ Ô_ return dnaBut, this returns the original sequence, plus the complement together. I'm guessing this has something to do with the + maybe? But I can't figure out how to just get the complement section.Ô_","Thursday, September 12th 2013, 3:22 am -04:00",1848,https://class.coursera.org/programming1-002/forum/thread?thread_id=1848, Resolved,get_complementary_sequence,1378970565,https://class.coursera.org/programming1-002/forum/list?forum_id=19,Assignment 2,0,1
,Exercises and Assignments / Assignment 2,,,Leya Rennert-May,post-10820,https://class.coursera.org/programming1-002/forum/thread?thread_id=1848#post-10820,It only returns '' now ??,"Thursday, September 12th 2013, 3:30 am -04:00",1848,https://class.coursera.org/programming1-002/forum/thread?thread_id=1848, Resolved,get_complementary_sequence,1378971042,https://class.coursera.org/programming1-002/forum/list?forum_id=19,Assignment 2,0,1
,Exercises and Assignments / Assignment 2,,,Leya Rennert-May,post-10824,https://class.coursera.org/programming1-002/forum/thread?thread_id=1848#post-10824,"I'm sorry, I'm not quite sure I followed that. :(Something like this:dna = ''Ô_ Ô_ for get_complement in dna:Ô_ Ô_ Ô_ Ô_ if get_complement in dna:Ô_ Ô_ Ô_ Ô_ Ô_ Ô_ get_complementary_sequence = get_complementary_sequence + get_complementÔ_ Ô_ Ô_ Ô_ Ô_ Ô_Ô_Ô_ Ô_ return dnaThis runs with an error though, so it's obviously still incorrect.Ô_","Thursday, September 12th 2013, 3:39 am -04:00",1848,https://class.coursera.org/programming1-002/forum/thread?thread_id=1848, Resolved,get_complementary_sequence,1378971573,https://class.coursera.org/programming1-002/forum/list?forum_id=19,Assignment 2,0,1
,Exercises and Assignments / Assignment 2,,,Leya Rennert-May,post-10830,https://class.coursera.org/programming1-002/forum/thread?thread_id=1848#post-10830,Got it! Thank you so much! :),"Thursday, September 12th 2013, 3:58 am -04:00",1848,https://class.coursera.org/programming1-002/forum/thread?thread_id=1848, Resolved,get_complementary_sequence,1378972707,https://class.coursera.org/programming1-002/forum/list?forum_id=19,Assignment 2,0,1
,Off-topic Discussion,,,Darshini Sinebare,post-1347,https://class.coursera.org/programming1-002/forum/thread?thread_id=104#post-1347,Hi from Papua New Guinea :),"Monday, August 19th 2013, 7:18 pm -04:00",104,https://class.coursera.org/programming1-002/forum/thread?thread_id=104,,where are you from? ....PLS sign it on the MAP :-),1376954305,https://class.coursera.org/programming1-002/forum/list?forum_id=2,Off-topic Discussion,1,1
,Course Tools,post-212,https://class.coursera.org/programming1-002/forum/thread?thread_id=58#post-212,Alberto Pardo Marti,comment-1547,https://class.coursera.org/programming1-002/forum/thread?thread_id=58#comment-1547,"Thank you Jaioson. Just, I was looking for IDLE in Fedora.","Friday, August 23rd 2013, 4:42 am -04:00",58,https://class.coursera.org/programming1-002/forum/thread?thread_id=58, Resolved,IDLE Fedora,1377247371,https://class.coursera.org/programming1-002/forum/list?forum_id=10,Course Tools,0,1
